{
  "schema": "mission-decision/v2",
  "decision_id": "decision-1234567890abcdef1234",
  "outcome": "approved",
  "grant_id": "grant-1234567890abcdef1234",
  "execution_id": "exec-mrgoyv8w-012f6e565f",
  "workspace_id": "wkspc-abc123def456",
  "capability": "email.send.external",
  "target": "person@example.com",
  "input_hash": "sha256:aaaaaaaaaaaaaaaaaaaaaaaaaaaaaaaaaaaaaaaaaaaaaaaaaaaaaaaaaaaaaaaa",
  "approval": "face_id_and_exact_preview",
  "principal": "paired-device:1234567890abcdef1234",
  "nonce": "1234567890abcdef1234567890abcdef",
  "decided_at": "2026-07-11T20:01:00.001Z",
  "expires_at": "2026-07-11T20:06:00.001Z",
  "source": "mission_mobile_approval",
  "authentication": {
    "method": "paired_device_token",
    "credential_id": "mobile-token:1234567890abcdef1234",
    "verified_at": "2026-07-11T20:01:00.001Z",
    "proof_digest": "sha256:bbbbbbbbbbbbbbbbbbbbbbbbbbbbbbbbbbbbbbbbbbbbbbbbbbbbbbbbbbbbbbbb"
  },
  "signature": {
    "algorithm": "ed25519",
    "version": "v1",
    "key_id": "wkspc-abc123def456:key-1234567890ab",
    "value": "AAAAaGVsbG8gd29ybGQgc2lnbmF0dXJlIGV4YW1wbGUgYnl0ZXM=",
    "signed_at": "2026-07-11T20:01:00.001Z"
  }
}
